https://www.filmfestival.gr/el/movie/movie/12353,"Γάτα μέσα στον τοίχο","Cat in the Wall",2019,Βουλγαρία, Ηνωμένο Βασίλειο, Γαλλία,"Η Ιρίνα, μια ανύπαντρη μητέρα από τη Βουλγαρία, μένει στις εργατικές κατοικίες στα προάστια του Λονδίνου. Όπως είναι αναμενόμενο, η ζωή της είναι κάθε άλλο παρά ειδυλλιακή: οι προσπάθειες να αξιοποιήσει το πτυχίο Αρχιτεκτονικής που έφερε από την πατρίδα πέφτουν στο κενό, καθώς η δουλειά στο μπαρ και οι καθημερινοί καβγάδες με τους γείτονες την απομακρύνουν ολοένα περισσότερο από τα όνειρά της. Ώσπου, μια μέρα, κάνει την εμφάνισή της μια αδέσποτη τσαχπίνα γάτα… Ένα στιβαρό δείγμα κοινωνικού ρεαλισμού στα χνάρια της ένδοξης βρετανικής κινηματογραφικής παράδοσης, όπου ένα φαινομενικά ασήμαντο γεγονός εξελίσσεται σε αλληγορία για τη μισαλλοδοξία, την προκατάληψη, την ξενοφοβία."
https://www.filmfestival.gr/el/movie/movie/12354,"Σώμα Χριστού","Boże Ciało",2019,Πολωνία, Γαλλία,"Ο Ντάνιελ είναι τρόφιμος ενός κέντρου κράτησης ανηλίκων, όπου περνά τις μέρες του στοιχειωμένος από το παρελθόν του. Όνειρό του είναι να γίνει ιερέας, αλλά το ποινικό του μητρώο απαγορεύει κάθε τέτοια σκέψη. Όπως όμως όλοι γνωρίζουν, όταν ο άνθρωπος κάνει σχέδια, ο Θεός γελά. Έτσι, όταν καταφτάνει σε ένα απομακρυσμένο πολωνικό χωριό, ο Ντάνιελ περνιέται για ιερέας και όχι μόνο φορά τα άμφια από τη μια μέρα στην άλλη, αλλά γίνεται και κοινωνός ενός σκοτεινού μυστικού που βασανίζει την κοινότητα. Ένα πνευματικό οδοιπορικό στην πίστη και την αμαρτία, στις δομές εξουσίας και τις ταξικές συγκρούσεις, μέσα από τα μάτια ενός γοητευτικού και ηθικά αμφιλεγόμενου απόκληρου ήρωα."
https://www.filmfestival.gr/el/movie/movie/12355,"Η θαυμάστρια","Der Fan",1982,Δυτική Γερμανία,"Η δεκαεπτάχρονη Σιμόν έχει αναπτύξει μια νοσηρή εμμονή στο πρόσωπο του νέου ποπ εφηβικού ειδώλου. Όταν αποφασίσει να ταξιδέψει έως το Μόναχο με οτοστόπ για να τον συναντήσει, η ιστορία μας θα πάρει μια διεστραμμένη και αιματοβαμμένη τροπή. Το ξέσπασμα της ηρωίδας σε αυτό το καλτ φεμινιστικό σύμβολο του δυτικογερμανικού σινεμά του ’80 απορρέει από μια οδυνηρή διαπίστωση: το αντικείμενο του πόθου της είναι και αυτός κομμάτι του πατριαρχικού κόσμου από τον οποίο πασχίζει να ξεφύγει με τη φαντασία της. Το εξελιγμένο μοντέλο ενός συστήματος ελέγχου, που έχει απλώς αλλάξει δέρμα, φορώντας ένα πιο γοητευτικό περίβλημα."
https://www.filmfestival.gr/el/movie/movie/12356,"Τα χελιδόνια της Καμπούλ","Les Hirondelles de Kaboul",2019,Γαλλία,"Καμπούλ, τέλη της δεκαετίας του 1990. Η επικράτηση των Ταλιμπάν έχει βυθίσει τη χώρα στον σκοταδισμό. Κάθε μορφή καλλιτεχνικής έκφρασης φιμώνεται, δημόσιοι λιθοβολισμοί και εκτελέσεις πραγματοποιούνται σε καθημερινή βάση, ο φόβος έχει τρυπώσει στην καρδιά και στο μυαλό των πολιτών, οι γυναίκες αντιμετωπίζονται ως αντικείμενα και όχι ως ανθρώπινα όντα. Σε αυτή την περίτεχνη animation μεταφορά του ομότιτλου μπεστ σέλερ του Αλγερινού συγγραφέα Γιασμίνα Χάντρα, η ελπίδα βρίσκει τρόπο να επιβιώσει σε ένα νοσηρό περιβάλλον. Μια σπαρακτική ιστορία ανείπωτης οδύνης και μεγαλειώδους αυτοθυσίας, που μας υπενθυμίζει ότι η ανθρωπιά είναι η ευγενέστερη των αρετών."
https://www.filmfestival.gr/el/movie/movie/12357,"Η Ντάφνε","Dafne",2019,Ιταλία,"Ο απροσδόκητος χαμός της μητέρας της αφήνει την Ντάφνε, μια νεαρή κοπέλα με σύνδρομο Down, και τον πατέρα της σε κατάσταση σοκ. Πολύ σύντομα οι ρόλοι αντιστρέφονται και η Ντάφνε επωμίζεται το βάρος της φροντίδας και της ψυχολογικής υποστήριξης του πατέρα της, που δυσκολεύεται να διαχειριστεί το πένθος του. Μια εκδρομή στην ύπαιθρο της Τοσκάνης θα βοηθήσει πατέρα και κόρη να αντλήσουν δύναμη ο ένας από τον άλλο και να αποδεχθούν τις δραματικές αλλαγές που έχουν επέλθει. Ένα οδοιπορικό ανιδιοτελούς και αδιαπραγμάτευτης συντροφικότητας το οποίο αποφεύγει τις μελοδραματικές κορόνες και τα συναισθηματικά τεχνάσματα."
https://www.filmfestival.gr/el/movie/movie/12358,"Αύριο, θα","Chun nuan hua kai",2019,Γερμανία, Κίνα, Σερβία,"Αναζητώντας μια καλύτερη ζωή, ο Λι έχει μεταναστεύσει από την επαρχία στο Πεκίνο, όπου βρίσκει δουλειά ως νυχτοφύλακας σε ένα αχανές κτιριακό συγκρότημα. Το Πεκίνο του Λι απέχει έτη φωτός από την εικόνα μιας υπερσύγχρονης μεγαλούπολης που σφύζει από ζωή, θυμίζοντας περισσότερο μια χωματερή ανθρώπων που περιβάλλονται από ερείπια και σκουπίδια. Σαν φάντασμα που περιφέρεται χωρίς σκοπό, ο Λι εκτελεί με την απάθεια μιας μηχανής μικροδουλειές που κανείς δεν του έχει αναθέσει και κανείς δεν παρατηρεί. Ένα κράμα ωμότητας και λυρισμού, με μεγαλοπρεπή στατικά πλάνα, φυσικούς ήχους και μη επαγγελματίες ηθοποιούς, που μεταμορφώνει τη στρεβλωμένη πραγματικότητα σε μια καθόλα χειροπιαστή αλήθεια."
https://www.filmfestival.gr/el/movie/movie/12359,"Το νου σου στα παιδιά","Barn",2019,Νορβηγία, Σουηδία,"Όσλο, σε ένα μεσοαστικό προάστιο. Η κόρη ενός εξέχοντος μέλους του Σοσιαλιστικού Κόμματος προκαλεί άθελά της τον θάνατο ενός συμμαθητή της, γιου ενός διακεκριμένου πολιτικού της Δεξιάς. Οι συντετριμμένοι γονείς, το προσωπικό του σχολείου, αλλά και ολόκληρη η τοπική κοινωνία, καλούνται να διαχειριστούν μια τραυματική κατάσταση, που επιδεινώνεται ακόμη περισσότερο από έναν ιστό κρυφών σχέσεων και αντικρουόμενων συναισθημάτων που συνδέει όλους τους εμπλεκόμενους. Το κερασάκι στην τούρτα έρχεται όταν αντιφατικές εκδοχές του τραγικού συμβάντος βγαίνουν στην επιφάνεια, ενισχύοντας την αμφιβολία και το αίσθημα ματαιότητας. Ένα χαμηλόφωνο δράμα χαρακτήρων που ψηλαφεί την αδυναμία επικοινωνίας και στο οποίο άπαντες είναι δικαιωμένοι και υπόλογοι την ίδια ακριβώς στιγμή."
https://www.filmfestival.gr/el/movie/movie/12360,"Ο εγκληματίας","Borotmokmedi",2019,Γεωργία, Ρωσία,"Ο Γκιόργκι, ένας εσωστρεφής εικοσιοκτάχρονος μηχανικός, βρίσκει τυχαία στην άκρη του δρόμου το άψυχο σώμα ενός διάσημου τερματοφύλακα. Ενθουσιασμένος με την αναπάντεχη και μακάβρια ανακάλυψή του, δεν αναφέρει τίποτα σε κανένα, όμως σύντομα απογοητεύεται καθώς το σπουδαίο μυστικό του παίζει πρώτο θέμα σε όλα τα κανάλια. Πιο ζωντανός από ποτέ, χάρη στο συμβάν αυτό που του έχει γίνει έμμονη ιδέα, ο Γκιόργκι αποφασίζει να ανακαλύψει μόνος του τον δολοφόνο, προσπερνώντας στην πορεία κάθε ηθικό φραγμό. Ένα κράμα ψυχολογικού θρίλερ και αστυνομικού μυστηρίου, που σταδιακά ξεδιπλώνεται σε μια ντοστογιεφσκικού τύπου παραβολή για την ανθρώπινη συντριβή."
https://www.filmfestival.gr/el/movie/movie/12361,"Ο Πατρίκ","De Patrick",2019,Βέλγιο,"Ο Πατρίκ, ετών 38, μένει σε ένα κάμπινγκ γυμνιστών με τους γονείς του. Χωρίς την παραμικρή φιλοδοξία, είναι πλήρως ικανοποιημένος έχοντας αναλάβει τον ρόλο του «ανθρώπου για όλες τις δουλειές» που περνά απαρατήρητος. O θάνατος του πατέρα του αλλάζει τα δεδομένα, εξοστρακίζοντας τον Πατρίκ από τον ασφαλή παράδεισο της μετριότητας. Καθώς ανακηρύσσεται διευθυντής του κάμπινγκ, ο Πατρίκ αναγκάζεται να επωμιστεί ευθύνες για πρώτη φορά στη ζωή του. Τα πράγματα θα χειροτερέψουν όταν ένα από τα σφυριά του εξαφανιστεί, γεγονός που θα τον βυθίσει σε μια κατάσταση ψυχολογικού σοκ και αποπροσανατολισμού. Μια δροσερή κωμικοτραγωδία, που παίρνει σταδιακά τη μορφή μιας υπαρξιακής αναζήτησης με τελικό έπαθλο την αξιοπρέπεια."
https://www.filmfestival.gr/el/movie/movie/12363,"Ο πύραυλος","Ο πύραυλος",2019,Ελλάδα, Ιταλία,"Ο Στάθης, γνωστός για τη μυθομανία του, αναγκάζεται να αποδείξει στους φίλους του την ύπαρξη ενός «απόρρητου πυραύλου» (που μόνο εκείνος ξέρει), προκειμένου να μην τους χάσει. Μια ταινία γυρισμένη αποκλειστικά με μη ηθοποιούς στην πορεία τεσσάρων ετών,"
https://www.filmfestival.gr/el/movie/movie/12364,"Η ανάκριση","Η ανάκριση",2019,Ελλάδα,"Όταν ένα επιθετικό και γεμάτο θυμό κορίτσι εγκαταλείπεται για άλλη μια φορά από τον σύντροφό της, συνειδητοποιεί ότι η σχέση της με τον πατέρα της είναι αυτή που δηλητηριάζει τη συμπεριφορά της, αποτρέποντας οποιονδήποτε προσπαθεί να την αγαπήσει. Με αυτή την αφορμή, αποφασίζει να ανασκαλέψει το παρελθόν του βασανισμένου από τη χούντα πατέρα της."
https://www.filmfestival.gr/el/movie/movie/12366,"Το αίμα του πελεκάνου","Pelikanblut",2019,Γερμανία, Βουλγαρία,"Η Βίμπκε είναι μια ανύπαντρη μητέρα, εκπαιδευτής αλόγων στο επάγγελμα, που αποφασίζει να υιοθετήσει και δεύτερο κοριτσάκι. Ευθύς εξαρχής, ένας πίνακας που απεικονίζει έναν θηλυκό πελεκάνο να ταΐζει με το ίδιο του το αίμα ένα νεκρό νεογέννητο, επαναφέρoντάς το στη ζωή, λειτουργεί ως δυσοίωνο προμήνυμα. Πράγματι, σαν μια αυτοεκπληρούμενη προφητεία, το νέο μέλος της οικογένειας αναπτύσσει βίαιη συμπεριφορά, σκορπώντας ανησυχία και φόβο. Η Βίμπκε, αδυνατώντας να αποδεχτεί ότι έχει αποτύχει ως μητέρα, απορρίπτει κάθε επιστημονική εξήγηση και βυθίζεται σε ένα σκοτεινό δαίδαλο μεταφυσικού παραλογισμού. Mια ζοφερή παραβολή βραδυφλεγούς τρόμου, που εξερευνά τα αχαρτογράφητα και ιλιγγιώδη μονοπάτια της μητρότητας."
https://www.filmfestival.gr/el/movie/movie/12367,"Η ομορφιά της ύπαρξης","Om det oändliga",2019,Σουηδία, Γερμανία, Νορβηγία,"«Αντίκρισα έναν άνθρωπο που είχε χάσει τον δρόμο του, αντίκρισα έναν άνθρωπο που εκλιπαρούσε για τη ζωή του»: λόγια που θα μπορούσαν να φορεθούν σε οποιαδήποτε από τις μοναχικές καρδιές και χαμένες ψυχές που παρελαύνουν μπροστά μας, σαν εκθέματα σε μουσείο με ανθρώπινα παράδοξα. Μια διαβολικά πνευματώδης ανορθόδοξη κωμωδία, η οποία εξυψώνει το μονότονο και προσδίδει βάθος στο κενό, προσφέροντας ένα θλιμμένο αλλά τρυφερό αντίδοτο στην αποξένωση και τη σύγχυση. Μια πομπή από βινιέτες που τρεμοπαίζουν, σε καφέ, μπαρ, σταθμούς τρένων, διαμερίσματα και γραφεία, διάστικτες με χλωμές σημαδούρες που αποζητούν ένα βλέμμα παρηγοριάς και κατανόησης."
https://www.filmfestival.gr/el/movie/movie/12368,"Εγκλωβισμένος","Eynayim Sheli",2019,Ισραήλ, Γερμανία,"Ο Ρασί, αστυνομικός στο Τελ Αβίβ εδώ και δεκαπέντε χρόνια, θα δει τον κόσμο του να καταρρέει, όταν, μετά από μια τυπική διαδικασία αστυνομικού ελέγχου, κατηγορείται άδικα για σεξουαλική παρενόχληση και τίθεται σε διαθεσιμότητα. Ο Ρασί ξεσπάει τα νεύρα του στο σπίτι και, ερχόμενος σε σύγκρουση με τη θετή του κόρη, οδηγεί τον γάμο του σε αδιέξοδο. Μια πρωτοποριακή σκηνοθετική προσέγγιση, που απορρίπτει τον καθιερωμένο διαχωρισμό μεταξύ μυθοπλασίας και πραγματικότητας: όλοι οι βασικοί ρόλοι ενσαρκώνονται από μη ηθοποιούς, οι οποίοι υιοθέτησαν τη ζωή των χαρακτήρων τους για σχεδόν έναν ολόκληρο χρόνο. Η κινηματογραφική αφήγηση σε νέα μονοπάτια ακατέργαστου αισθήματος και πρωτοφανούς αυθορμητισμού."
https://www.filmfestival.gr/el/movie/movie/12369,"Madre","Madre",2019,Ισπανία, Γαλλία,"Στα 40 της, η Ελένα έχει αφήσει πίσω της την Ισπανία για να ζήσει στη Γαλλία, στο μέρος όπου εξαφανίστηκε ο εξάχρονος γιος της δέκα χρόνια πριν. Τσακισμένη από την τραγωδία, σκιά του παλιού της εαυτού, προσπαθεί να μαζέψει τα κομμάτια της και να κάνει μια νέα αρχή, όταν η συνάντηση με ένα εύθραυστο έφηβο αγόρι, που μοιάζει στον χαμένο της γιο, της ξυπνά επώδυνες μνήμες. Η οδύνη της απότομης ενηλικίωσης και το φορτίο του πένθους θα βαδίσουν μαζί τον δρόμο της λύτρωσης, σε ένα τολμηρό ψυχολογικό δράμα, που αποτυπώνει τον αβάσταχτο πόνο της απώλειας, με κάδρα και συνθέσεις μαγευτικής αρμονίας."
https://www.filmfestival.gr/el/movie/movie/12370,"Το βαμμένο πουλί","Nabarvene Ptace",2019,Τσεχία, Ουκρανία, Σλοβακία,"Ένα εγκαταλελειμμένο και ανώνυμο Εβραιόπουλο, του οποίου η οικογένεια έχει πιθανότατα εξολοθρευτεί, βολοδέρνει από μαρτύριο σε μαρτύριο, στο ανελέητο χρονικό μιας αποκτηνωμένης και βάρβαρης εποχής. Μεταφέροντας στη μεγάλη οθόνη το ομότιτλο μυθιστόρημα του Πολωνο-Αμερικάνου συγγραφέα Γιέρζι Κοσίνσκι, η ταινία εξιστορεί τα απάνθρωπα βάσανα ενός ανήλικου αγοριού που πασχίζει να επιβιώσει στα αποκαΐδια της ρημαγμένης Ευρώπης, την επαύριο του Β΄ Παγκοσμίου Πολέμου. Ένα αποπνικτικό δράμα γλαφυρής ωμότητας, γυρισμένο σε εκθαμβωτικό ασπρόμαυρο φιλμ 35mm, που βυθομετρά την ανθρώπινη κόλαση και ανταλλάσσει ματιές με την άβυσσο, προτού αφήσει να γλιστρήσει μια απειροελάχιστη αχτίδα ελπίδας."
https://www.filmfestival.gr/el/movie/movie/12371,"Επίγειος παράδεισος","It Must Be Heaven",2019,Γαλλία,"Μια αλλοπρόσαλλη φιγούρα, ένας Ζακ Τατί του σήμερα, πίνει κρασί και παρατηρεί μια παράδοξη σκηνή: ένας κλέφτης, που αρπάζει φρούτα από τον κήπο του γείτονά του, υποστηρίζει ένθερμα πως έχει την άδεια του ιδιοκτήτη. Κι όμως, κάθε μέρα μπαινοβγαίνει στα ξένα χωράφια όλο και πιο άνετα, σαν να του ανήκουν. Ο Ελία Σουλεϊμάν υποδύεται μια ακόμη σιωπηλή εκδοχή του εαυτού του, επινοώντας ακόμη πιο υπαινικτικούς και ευφυείς τρόπους για να απεικονίσει τη γκετοποίηση των Παλαιστινίων. Αναζητώντας μια αίσθηση πατρίδας μακριά από τη γενέθλια γη, συναντά την αποξένωση στο Παρίσι και την εχθρότητα στη Νέα Υόρκη, προτού αφεθεί ολόψυχα στο εγγενές παράλογο της ζωής."
https://www.filmfestival.gr/el/movie/movie/12372,"Μη νομίζεις πως θα ουρλιάξω","Ne croyez surtout pas que je hurle",2019,Γαλλία,"Αυτοεξόριστος για μήνες σε ένα μικρό χωριό της Αλσατίας, μετά από έναν επώδυνο χωρισμό, ο Φρανκ Μποβέ αναπλάθει τον σταδιακό του εθισμό στη μοναξιά. Μόνη του παρηγοριά το σινεμά, καθώς κάθε βράδυ βυθίζεται λαίμαργα σε ένα παράλληλο σύμπαν που λειτουργεί ως ανάχωμα καλαισθησίας μπροστά στην ασχήμια των πραγμάτων. Σταδιακά, το καταφύγιό του μετατρέπεται σε κελί, και οι ταινίες από παράθυρα διαφυγής γίνονται παραμορφωτικοί καθρέφτες. Ένα οδοιπορικό κάθαρσης στη βασανισμένη ψυχή του καλλιτέχνη, με οδηγό ένα κεραυνοβόλο κολάζ από εκατοντάδες κινηματογραφικα ενσταντανέ. Το μονοπάτι που οδηγεί στο φως περνά πάντα μέσα από το σκοτάδι."
https://www.filmfestival.gr/el/movie/movie/12373,"Ο Γιάκομπ, η Μίμι και τα σκυλιά που μιλάνε","Jēkabs, Mimmi un runājošie suņi",2019,Λετονία, Πολωνία,"Ο Γιάκομπ ονειρεύεται να γίνει αρχιτέκτονας και περνά τον χρόνο του σκιτσάροντας και ονειροπολώντας. Όταν θα περάσει μια βδομάδα με τη Μίμι, την ξερόλα ξαδέρφη του που μένει σε ένα υποβαθμισμένο, αλλά ιστορικό, προάστιο στη Ρίγα, o Γιάκομπ θα βυθιστεί σε έναν πρωτόγνωρο κόσμο. H περιπέτεια, η φιλία και τα θαύματα θα πάρουν τα ηνία, καθώς το φαινομενικά αταίριαστο δίδυμο αναλαμβάνει να σώσει το πάρκο της γειτονιάς από τις ορέξεις ενός άπληστου μεγιστάνα. Στις δύσκολες στιγμές, όλοι στρεφόμαστε στους φίλους και τα δύο ξαδέρφια μπορούν σίγουρα να νιώθουν τυχεροί: μια αγέλη από πιστά και –πάνω απ’ όλα– ομιλόντα τετράποδα είναι εκεί για να τους προστατέψει!"
https://www.filmfestival.gr/el/movie/movie/12374,"Ρετσίνι","Harpiks",2019,Δανία,"Η Λιβ, μια δεκατριάχρονη έφηβη, o εμμονικός πατέρας και η κατάκοιτη μητέρα της ζουν εντελώς αποκομμένοι από τον υπόλοιπο κόσμο σε ένα απομονωμένο νησί και βασίζονται στη φύση για την επιβίωσή τους. Όμως, η εκούσια φυλακή στην οποία έχουν εγκλειστεί αρχίζει να εμφανίζει ρωγμές, όταν η Λιβ αμφισβητεί την κοσμοθεωρία των γονιών της, φέρνοντας ανομολόγητα μυστικά στο φως. Ένα βουκολικό δράμα, στο οποίο η φύση απεικονίζεται ειδυλλιακή και ασφυκτική, αχανής και κλειστοφοβική, καθρεφτίζοντας τις συγκρούσεις και τις σχέσεις των πρωταγωνιστών. Μια μυσταγωγική παραλλαγή των παραδοσιακών σκανδιναβικών μύθων, που κατρακυλά στα άδυτα της παράνοιας και της βίας."
