https://www.filmfestival.gr/el/movie/movie/12395,"Ο κήπος του Θεού","Ο κήπος του Θεού",1994,Ελλάδα,"Κάπου κοντά στα Χριστούγεννα, άνθρωποι της καθημερινότητας, o Κοντός, ο Ψηλός, ο Αλέκος και ο Σινούε, αποφασίζουν να εφεύρουν ξανά τον εαυτό τους, γιατί στον «Κήπο του Θεού» και οι πέτρες έχουν αλλάξει όψη… Παίζουν μπάλα, πηγαίνουν στην εκκλησία, μαθαίνουν χορό, λένε ποιήματα, χάνουν τους φίλους, χτυπούν τους εχθρούς, ζωγραφίζουν με την ανάσα τους ευχές που θέλουν να στείλουν. Φτάνουν στα όρια… Κάνουν εξεγέρσεις, καίνε στρώματα, σπάζουν μαδέρια, ματώνουν και υπόσχονται στον εαυτό τους ότι αυτά τα Χριστούγεννα θα κατηφορίσουν στη θάλασσα… Με αφορμή μια ιστορία φυλακής, μια ταινία για τον ανθρώπινο πόνο και τη φιλία."
https://www.filmfestival.gr/el/movie/movie/12396,"Τρέχοντας στο κενό","Running on Empty",1988,ΗΠΑ,"O έφηβος Ντάνι έχει μεγαλώσει σε μια ιδιαίτερη οικογένεια. Οι γονείς του ευθύνονται για μια βομβιστική ενέργεια στις αρχές της δεκαετίας του 70 και από τότε ζούνε κυνηγημένοι από το FBI. Ο Σίντεϊ Λιουμέτ, αμέσως μετά το"
https://www.filmfestival.gr/el/movie/movie/12397,"Αλεπουδίτσες","Foxes",1980,ΗΠΑ,"Τέσσερα κορίτσια μεγαλώνουν επικίνδυνα στο Σαν Φερνάντο Βάλεϊ του Λος Άντζελες. Στο ντεμπούτο του, ο παραγνωρισμένος στυλίστας Έιντριαν Λάιν δημιούργησε την πιο αληθινή και συναρπαστική κινηματογραφική κοριτσοπαρέα. Η Τζόντι Φόστερ και η Τσέρι Κάρι των Runaways, το φοβερό σάουντρακ του Τζόρτζιο Μορόντερ, το πέρασμα από τη δεκαετία του ’70 σε αυτή του ’80 και η αρχή της μανίας με τα teen movies."
https://www.filmfestival.gr/el/movie/movie/12398,"Σκοπιά","Vigil",1984,Νέα Ζηλανδία,"Ένα πρωτότυπο βουκολικό steampunk δράμα με μια νεαρή πρωταγωνίστρια-αποκάλυψη και μια ζοφερή ατμόσφαιρα που παραπέμπει στο"
https://www.filmfestival.gr/el/movie/movie/12399,"Οι περιπέτειες του Μαρκ Τουέιν","The Adventures of Mark Twain",1985,ΗΠΑ,"Μια ελεύθερη συρραφή από κείμενα και ιδέες του Μαρκ Τουέιν ήταν η ιδέα του Γουίλ Βίντον για την πρώτη αμερικανική μεγάλου μήκους ταινία που θα γυριζόταν με την τεχνική του animation με πηλό. Αποτυχία την εποχή που κυκλοφόρησε, τώρα πια θεωρείται από τα αριστουργήματα του είδους. Σκοτεινό, τολμηρό και αξέχαστο με τη σεκάνς με τον «Μυστηριώδη Ξένο» να δημιουργεί τους πιο άγριους εφιάλτες ενηλικίωσης."
https://www.filmfestival.gr/el/movie/movie/12400,"Μόνο 6,5","Metri Shesh-o Nim",2019,Ιράν,"Πρωτοστατώντας στη σταυροφορία ενάντια στη διάβρωση της ιρανικής κοινωνίας από τα ναρκωτικά, ο Σαμάντ, αστυνομικός της Δίωξης, βάζει στο στόχαστρο τον διαβόητο ναρκοβαρόνο Νάσερ. Δεν πρόκειται, ωστόσο, για την κλασική μονομαχία του Καλού με το Κακό, αλλά για μια σισύφεια μάχη που αφήνει άπαντες ηττημένους. Η αρχική πλοκή ενός αγωνιώδους αστυνομικού θρίλερ σύντομα αλλάζει ύφος και τέμπο, αποτυπώνοντας τα αμέτρητα αδιέξοδα ενός εφιαλτικού κόσμου απληστίας και θανάτου, απ’ όπου δεν υπάρχει διαφυγή. Μια ζοφερή ματιά στην αναποτελεσματικότητα τόσο του νόμου και όσο και των καλών προθέσεων, όταν ο εχθρός είναι θηρίο με αμέτρητα κεφάλια."
https://www.filmfestival.gr/el/movie/movie/12401,"Ο φύλακας","Sorkhpoust",2019,Ιράν,"Δεκαετία του 1960, Ιράν επί τελευταίου Σάχη. Στη μέση του πουθενά, σε μια φυλακή που εκκενώνεται για να κατεδαφιστεί, ο ταγματάρχης Γιαχέντ κορδώνεται για την επικείμενη προαγωγή του. Σύντομα ωστόσο θα δει τα γαλόνια του να κινδυνεύουν, όταν ένας θανατοποινίτης κρατούμενος εξαφανίζεται μυστηριωδώς. Στο παράδοξο ανθρωποκυνηγητό που ακολουθεί, ο Γιαχέντ γοητεύεται από μια κοινωνική λειτουργό, η οποία συμμετέχει στην έρευνα, πεπεισμένη όμως πως ο καταζητούμενος είναι αθώος. Ένα αγωνιώδες θρίλερ με φόντο τον καφκικό λαβύρινθο μιας άδειας φυλακής, όπου η παντοδυναμία της εξουσίας απομυθοποιείται και, όσο περνούν οι ώρες, καταρρέει."
https://www.filmfestival.gr/el/movie/movie/12402,"Ατλαντίδα","Atlantis",2019,Ουκρανία,"Ανατολική Ουκρανία, έτος 2025, στον απόηχο ενός ολέθριου πολέμου. Το περιβάλλον έχει πληγεί ανεπανόρθωτα, ολόκληρη η περιοχή έχει κηρυχθεί μη κατοικήσιμη και οι άνθρωποι περιφέρονται σαν στοιχειά γυρεύοντας τρόπο να νιώσουν ζωντανοί. Ο Σέργκιϊ, ένας πρώην στρατιώτης που υποφέρει από μετατραυματικό στρες, συμμετέχει σε μια εθελοντική ομάδα που ταυτοποιεί τους νεκρούς των μαζικών τάφων. Η παγωμένη φωνή του ιατροδικαστή συνυφαίνεται με την ωμότητα και την ψυχρή μουντάδα του μεταποκαλυπτικού τοπίου, σε μια δυστοπική παραβολή για την ελπίδα που φυτρώνει στα πιο ανέλπιστα μέρη και την ανθρωπιά που επιζεί κάτω απ’ τα χαλάσματα."
https://www.filmfestival.gr/el/movie/movie/12403,"Άρρωστα σκυλιά","The Plague Dogs",1982,Ηνωμένο Βασίλειο, ΗΠΑ,"Δύο σκυλιά αποδρούν από ένα ερευνητικό κέντρο όπου τους κάνουν φρικτά πειράματα και περιπλανιούνται στην επαρχιακή Αγγλία ψάχνοντας ένα μέρος για να ζήσουν ελεύθερα. Το αριστούργημα του Μάρτιν Ρόζεν, βασισμένο στο ομότιτλο μυθιστόρημα του Ρίτσαρντ Άνταμς –δεύτερη συνεργασία τους μετά το θρυλικό"
https://www.filmfestival.gr/el/movie/movie/12404,"Καρτ ποστάλ από το τέλος του κόσμου","Καρτ ποστάλ από το τέλος του κόσμου",2019,Ελλάδα,"Παγιδευμένοι στη δυσλειτουργία των οικογενειακών τους διακοπών, το τελευταίο πράγμα που θα περίμεναν να αντιμετωπίσουν η Δήμητρα, ο Δημήτρης και οι δύο μικρές τους κόρες είναι το απρόσμενο τέλος του κόσμου."
https://www.filmfestival.gr/el/movie/movie/12405,"Chopper","Chopper",2019,Ηνωμένο Βασίλειο,"H Άντζι, μη μπορώντας να δεχτεί ότι θα στείλουν τον παππού της στο γηροκομείο –έναν πρώην μηχανόβιο που πάσχει από άνοια– για να περάσει εκεί τις τελευταίες του ημέρες, κλειδώνεται στο δωμάτιο μαζί του και προβαίνει σε μια τελευταία πράξη αγάπης."
https://www.filmfestival.gr/el/movie/movie/12406,"Για χρόνια πλάγιαζα νωρίς","Για χρόνια πλάγιαζα νωρίς",2019,Ελλάδα,"Ελλάδα, 2017. Η αδυναμία οικονομικής στήριξης του Άρη (πάσχοντα της νόσου του κινητικού νευρώνα / ALS) θέτει τη γυναίκα του, την Περσεφόνη, αντιμέτωπη με τα ανθρώπινα υπαρξιακά όρια. Πόσα χρόνια ταξίδι θέλει τελικά για να φτάσεις πραγματικά «σπίτι»;"
https://www.filmfestival.gr/el/movie/movie/12407,"I Am Mackenzie","I Am Mackenzie",2019,ΗΠΑ,"Παγιδευμένο ανάμεσα στην τοξική αρρενωπότητα, σ’ ένα λαμέ φόρεμα και σ’ έναν εφηβικό έρωτα, ένα αγοροκόριτσο από το επαρχιακό Τέξας κάνει σεξ για πρώτη φορά στο φορτηγάκι του πατέρα του"
https://www.filmfestival.gr/el/movie/movie/12408,"Η απόσταση ανάμεσα στον ουρανό κι εμάς","The Distance Between Us and the Sky",2019,Ελλάδα, Γαλλία,"Νύχτα, παλιά Εθνική Οδός. Σ’ ένα ξεχασμένο βενζινάδικο δύο άγνωστοι συναντιούνται για πρώτη φορά. Ο ένας έχει σταματήσει για να βάλει βενζίνη στη μηχανή του. Ο άλλος έχει ξεμείνει εκεί. Για να γυρίσει στην Αθήνα τού λείπουν 22,50€. Όσο ακριβώς κοστίζει η απόσταση που τους χωρίζει από τον ουρανό."
https://www.filmfestival.gr/el/movie/movie/12409,"Index","Index",2019,Σουηδία, Ελλάδα,"Η βάρκα που θα μεταφέρει την οικογένεια του Ντάνα στην Ευρώπη είναι έτοιμη να ξεκινήσει, αλλά ο γιος του, ο Άλαν, φαίνεται να αρνείται να αφήσει το φορτηγό. Ο Ντάνα βλέπει πως το δάχτυλο του Άλαν έχει σφηνώσει στην καρότσα του φορτηγού. Πανικός κυριεύει τον Ντάνα και η απόγνωση κορυφώνεται καθώς έρχεται αντιμέτωπος με μια τρομακτική απόφαση."
https://www.filmfestival.gr/el/movie/movie/12410,"Υπνοβατώντας","Υπνοβατώντας",2018,Αυστραλία,"Σε ένα απομονωμένο αγρόκτημα, η αφοσίωση ενός εφήβου και η αντίληψή του για τον έξω κόσμο δοκιμάζονται, καθώς πρέπει να βοηθήσει τη μητέρα του να γλιτώσει απ’ τον φανατικό πατριό του."
https://www.filmfestival.gr/el/movie/movie/12411,"Κλεονίκη","Κλεονίκη",2019,Ελλάδα,"Η υπεραιωνόβια Κλεονίκη ζει στα βουνά της Ευρυτανίας, τραγουδώντας και λέγοντας ιστορίες από τα παλιά. Μαζί της κατοικούν ο Κώστας και ο Γιώργος, δύο από τα οκτώ παιδιά της. Όλοι περιμένουν το πανηγύρι του Σωτήρος, όπου το μικρό χωριό ξαναζωντανεύει."
https://www.filmfestival.gr/el/movie/movie/12412,"Ο μάγκας","Ο μάγκας",2018,Ελλάδα,"Ο δωδεκάχρονος Στρατής είναι ο μεγαλύτερος μάγκας της γειτονιάς. Είναι τόσο μάγκας, που όλοι τον φωνάζουν «Μάγκα». Σχεδόν όλοι δηλαδή. Το μόνο που του μένει, είναι να το αποδείξει. Σε αυτούς που δεν τον πιστεύουν. Σχεδόν σε όλους δηλαδή."
https://www.filmfestival.gr/el/movie/movie/12413,"Pathologies of Everyday Life","Pathologies of Everyday Life",2019,Ελλάδα,"Ο Σεμπάστιαν κι ο Ρόμπιν ήταν οι παρίες του σχολείου. Σήμερα, δουλεύουν σε σουπερμάρκετ. Για όλα τους φταίει η κοινωνία - κι ο κ. Μπραντ, ο καθηγητής θεάτρου. Απόψε είναι η 10ετής επέτειος της αποφοίτησής τους. Έχουν αποφασίσει να στείλουν ένα μήνυμα: βαρέθηκαν να παίζουν τον Ρόζενκραντζ και τον Γκίλντενστερν."
https://www.filmfestival.gr/el/movie/movie/12414,"Ρουζ","Ρουζ",2019,Ελλάδα,"Ένα περιστατικό σεξιστικής βίας πυροδοτεί εντάσεις στη φιλία της Δανάης με την Ιλόνα και την Τούφα. Διχασμένες ανάμεσα σε θεωρία και πράξη, οι τρεις φίλες αντιλαμβάνονται πως η πατριαρχία δεν πεθαίνει (μόνο) με μπουκάλια, και πλέον έχουν τα σημάδια για να το αποδείξουν."
https://www.filmfestival.gr/el/movie/movie/12415,"Dark Sand","Sable noir",2018,Γαλλία, Ελλάδα,"Η Αλίκη, μια νέα γυναίκα που ζει στον γαλλικό βορρά, βρίσκει ηχογραφημένες κασέτες όπου διαφορετικοί άνθρωποι αφηγούνται τους εφιάλτες τους. Ενώ προσπαθεί να βρει τον αποστολέα των κασετών, θολώνουν τα όρια ανάμεσα στο όνειρο και την πραγματικότητα."
https://www.filmfestival.gr/el/movie/movie/12416,"Sad Girl Weekend","Sad Girl Weekend",2019,Ελλάδα,"Ένα τελευταίο Σαββατοκύριακο τριών κολλητών φίλων, από τις οποίες οι δύο θα φύγουν για μεταπτυχιακό στο εξωτερικό. Σύντομα συνειδητοποιούν ότι τα «αντίο» είναι δύσκολα να ειπωθούν."
https://www.filmfestival.gr/el/movie/movie/12417,"Το βάρος της θάλασσας","Το βάρος της θάλασσας",2019,Ελλάδα,"Ένα κορίτσι κάνει καθημερινά την ίδια διαδρομή από το σπίτι της προς τη θάλασσα. Στην πλάτη της κουβαλάει ένα δοχείο με το οποίο συλλέγει θαλασσινό νερό. Όταν το κορίτσι γυρίζει φορτωμένο στο σπίτι, κλείνει την πόρτα πίσω του και εμείς μένουμε μπροστάστην κλεισμένη πόρτα. Στο δωμάτιο δεν θα μπούμε παρά μόνο την τελευταία στιγμή."
https://www.filmfestival.gr/el/movie/movie/12418,"Βίαιη εξίσωση","Βίαιη εξίσωση",2019,Ελλάδα,"Σε έναν πολύχρωμο εξπρεσιονιστικό κόσμο, κάποιες μορφές αρχίζουν να αναπτύσσουν μια εξελικτική πορεία προς την τελειότητα. Κάποιες από τις υπόλοιπες μορφές αντιμετωπίζουν τις «εξελιγμένες» με φόβο και αποφασίζουν να τις καταστρέψουν. Όταν το κατορθώνουν, στρέφουν τη βία τους σε όποιον τολμά να είναι διαφορετικός. Κυριαρχεί η λατρεία της άγνοιας και το ευαγγέλιο του φθόνου μιας οργανωμένης μειοψηφίας."
https://www.filmfestival.gr/el/movie/movie/12419,"W","W",2019,Ελλάδα, Ηνωμένο Βασίλειο,"Ένας δάσκαλος ετοιμάζεται να κάνει το καθημερινό του μάθημα στο σχολείο που εργάζεται, κατά τη διάρκεια μίας από τις πιο δύσκολες μέρες να διδάξει."
https://www.filmfestival.gr/el/movie/movie/12420,"Έτος εθελοντισμού","Das freiwillige Jahr",2019,Γερμανία,"Ο Ουρς είναι γιατρός σε μια επαρχιακή πόλη στη Γερμανία, όπου ζει με τη δεκαοκτάχρονη κόρη του, τη Γιέτε. Σε μια παράδοξη αντιστροφή των ρόλων, ο Ουρς, που υπαγορεύει στη Γιέτε πώς να ζήσει τη ζωή της, καταβάλει τεράστιες προσπάθειες να την πείσει να ανοίξει τα φτερά της και να περάσει ένα έτος εθελοντικής εργασίας στην Κόστα Ρίκα. Εκείνη, από την άλλη, αυτό που θέλει πραγματικά είναι να μην το κουνήσει ρούπι και να περάσει τον χρόνο αυτόν τριγυρίζοντας άσκοπα με τον φίλο της. Ένα πνευματώδες κράμα οικογενειακού δράματος και κωμωδίας καθημερινών καταστάσεων για τις δύσκολες επιλογές που οδηγούν στην ενηλικίωση."
https://www.filmfestival.gr/el/movie/movie/12421,"Η αγία οικογένεια","La Sainte famille",2019,Γαλλία,"Σε μια ειρωνική συγκυρία, ο Ζαν, γνωστός ανθρωπολόγος και ακαδημαϊκός, αναλαμβάνει υπουργός Οικογένειας τη στιγμή που τα θεμέλια της δικής του οικογένειας σείονται από συνεχείς έριδες και δοκιμασίες, τις οποίες ο ίδιος νιώθει ανήμπορος να διαχειριστεί. Μια χαμηλόφωνη και καλοζυγισμένη σπουδή στην εκκεντρική συμπεριφορά, τις συμβάσεις και τους συμβιβασμούς της μεγαλοαστικής τάξης στη Γαλλία. Μια μελαγχολική και ενίοτε σαρκαστική ματιά σε έναν θίασο σύγχρονων μπαλζακικών χαρακτήρων, που αμφιταλαντεύονται ανάμεσα στα «θέλω» και τα «πρέπει» τους, μετέωροι μπροστά στον πειρασμό να αφεθούν στην αβίαστη ροή της ζωής."
https://www.filmfestival.gr/el/movie/movie/12422,"Στάση","Ang Hupa",2019,Φιλιππίνες,"Φιλιππίνες, 2034. Η χώρα έχει βυθιστεί στο έρεβος: ο ήλιος έχει εξαφανιστεί, έπειτα από μια κολοσσιαία φυσική καταστροφή, την ίδια στιγμή που ένας παρανοϊκός πρόεδρος δικαιολογεί την τυραννική εξουσία του στη βάση μιας ελέω θεού εντολής. Στις Φιλιππίνες του σήμερα, η παρουσία ενός ιπτάμενου στρατού από drones που επιβάλλουν τακτικές κοινωνικού ελέγχου υπονοεί ένα μετα-αποκαλυπτικό σκηνικό. Μια δυστοπική αλληγορία για το ζοφερό παρόν που φωλιάζει σε ένα χαοτικό μέλλον, η οποία αιχμαλωτίζει τον «ψυχικό κατακλυσμό της χώρας». Ένα πολιτικά φορτισμένο κράμα επιστημονικής φαντασίας και υποδόριου τρόμου, που τρυπώνει σε μια σιωπηλή άβυσσο διαβρωτικής λήθης."
https://www.filmfestival.gr/el/movie/movie/12423,"Ο φάρος","The Lighthouse",2019,ΗΠΑ,"Δύο άνδρες βλοσυροί και λιγομίλητοι επωμίζονται τη λειτουργία ενός απομονωμένου φάρου. Ο Τομ, βετεράνος ναυτικός με σκοτεινά μυστικά, φροντίζει το φως να εκπέμπει, ευθύνη που καθορίζει την ιεραρχία. Ο Έφραμ αναλαμβάνει τις ταπεινές δουλειές, νιώθοντας σταδιακά αποστροφή για τον σαρκασμό και την κυκλοθυμία του Τομ. Η απώλεια συντεταγμένων, η παράνοια και το ποτό θα πάρουν τα ηνία, καθώς το μοναχικό δίδυμο ακροβατεί ανάμεσα στο μίσος και στη συντροφικότητα. Ένας χορός παραισθήσεων και χειροπιαστού φόβου, που διαχέεται στο εκτυφλωτικό ασπρόμαυρο, αποκαλύπτοντας την πιο τρομακτική συνθήκη: την ίδια την πραγματικότητα. Μια δεσμίδα φωτός που τεμαχίζει το σκοτάδι θα αποδειχτεί πιο ανατριχιαστική και από το έρεβος."
https://www.filmfestival.gr/el/movie/movie/12425,"Αφρική","Africa",2019,Ισραήλ,"Σε ένα χωριό στη Δυτική Όχθη, ο Μεΐρ, ένας συνταξιούχος μηχανικός(μια δραματοποιημένη εκδοχή του πατέρα του σκηνοθέτη), χάνει τη γη κάτω από τα πόδια του, όταν ενημερώνεται ότι δεν θα αναλάβει την οργάνωση του τοπικού φεστιβάλ μετά από δεκαετίες σε αυτό το πόστο. Ο Μεΐρ διοχετεύει την απογοήτευσή του σε ένα φιλόδοξο πρότζεκτ χειρωνακτικής εργασίας, σε μια προσπάθεια να ξανανιώσει χρήσιμος και ζωντανός. Η γεμάτη ενέργεια αφοσίωσή του είναι μια πράξη αντίστασης απέναντι στη φθορά του σώματος, την πληγωμένη ανδρική υπερηφάνεια, το ξεθώριασμα του νοήματος στη ζωή. Μια τρυφερή και παρηγορητική ματιά στην οδύνη του χρόνου που περνά ανεπιστρεπτί, στην αποδοχή της θνητότητας."
https://www.filmfestival.gr/el/movie/movie/12426,"Καθημερινές γυναίκες","Simple Women",2019,Ιταλία, Ρουμανία,"“Fear of a female planet?”: Έτσι τελειώνει το Kool Thing των Sonic Youth στην πιο εμβληματική σκηνή του Simple Men του Χαλ Χάρτλεϊ. Το"
