https://www.filmfestival.gr/el/movie/movie/12286,"Βιταλίνα Βαρέλα","Vitalina Varela",2019,Πορτογαλία,"Μια λεπτοδουλεμένη σπουδή στο πένθος, στην απόγνωση, τη μοναξιά και τη μετα-αποικιοκρατική εκμετάλλευση, που αψηφά κάθε σύμβαση αφήγησης, πλοκής και χαρακτηρολογίας, χαρίζοντάς μας μια εμπειρία στοχαστική και υποβλητική. Ο Πέδρο Κόστα βυθίζεται στα ερεβώδη βάθη της αβύσσου, σε έναν τόπο φαντασμάτων τον οποίο διαφεντεύουν οι ζωντανοί-νεκροί, τα περιφερόμενα ανθρώπινα στοιχειά και οι χαμένες ψυχές που γεννήθηκαν μέσα στις σκιές. Σε μια ταινία που ζει και αναπνέει τη νύχτα, το μαύρο χρώμα είναι ενδεδυμένο με μια ιερή αποστολή –τόσο στον κόσμο των αισθήσεων όσο και σε αυτόν του πνεύματος–, θυμίζοντας τον ρόλο του λευκού στον Ντράγιερ και τον Μπρεσόν."
https://www.filmfestival.gr/el/movie/movie/12287,"Ενθύμιο","The Souvenir",2019,Ηνωμένο Βασίλειο,"Μια συνεσταλμένη φοιτήτρια κινηματογράφου ορθώνει ανάστημα όταν μπαίνει στη ζωή της ένας χαρισματικός –αν και όχι ιδιαίτερα έμπιστος– άντρας. Η παρουσία του τη βοηθά να ανεξαρτητοποιηθεί από την υπερπροστατευτική της μητέρα και τους σνομπ φίλους της, ωστόσο σταδιακά βυθίζεται σε μια τοξική σχέση γεμάτη ένταση, που την απομακρύνει από τα όνειρα και τις φιλοδοξίες της. Μια κατάδυση στην ψυχή του καλλιτέχνη και τη γυναικεία ιδιοσυγκρασία, που συνδυάζει τον διακριτικό υπαινιγμό με την αψεγάδιαστη αισθητική. Μια υποβλητική ιστορία αργοπορημένης ενηλικίωσης και επώδυνης γνωριμίας με τον έρωτα."
https://www.filmfestival.gr/el/movie/movie/12288,"Αρχιπέλαγος","Archipelago",2010,Ηνωμένο Βασίλειο,"Ένα χαμηλόφωνο πορτρέτο μιας οικογένειας που έχει βυθιστεί σε μια συναισθηματική δίνη. Ο Έντουαρντ, που βιώνει υπαρξιακή κρίση, ετοιμάζεται να αναχωρήσει για εθελοντική εκπαιδευτική εργασία στην Αφρική, όπου θα παραμείνει για ένα χρόνο. Η μητέρα και η αδελφή του αποφασίζουν να οργανώσουν μια οικογενειακή μάζωξη για να αποχαιρετήσουν (ή μήπως για να μεταπείσουν;) τον Έντουαρντ, σε ένα απομονωμένο νησάκι της Κορνουάλης. Ο αποξενωμένος πατέρας της οικογένειας δεν λέει να εμφανιστεί, δύο παράταιροι προσκεκλημένοι δίνουν το «παρών», και οι υπόγειες δυνάμεις του ανταγωνισμού και της μνησικακίας φέρνουν στην επιφάνεια τον θυμό και την ένταση που καιροφυλακτούσαν υπογείως."
https://www.filmfestival.gr/el/movie/movie/12289,"Πυγολαμπίδες","Luciérnagas",2018,Μεξικό, Ελλάδα, Δομινικανή Δημοκρατία,"Ο Ραμίν, προκειμένου να ξεφύγει από τη μοίρα που επιφυλάσσει η πατρίδα του στους ομοφυλόφιλους, ζει αιωρούμενος στο κενό της αυτοεξορίας. Όταν κρύφτηκε ως λαθρεπιβάτης σε ένα πλοίο που έφευγε από την Τουρκία, το τελευταίο μέρος όπου περίμενε να βρεθεί ήταν η Βερακρούς, στο Μεξικό, τόσο μακριά από οτιδήποτε οικείο και γνωστό. Εγκλωβισμένος σε αυτό το υποβαθμισμένο τροπικό λιμάνι, αντιλαμβάνεται σταδιακά ότι δεν έχει άλλη επιλογή παρά να απαγκιστρωθεί από το παρελθόν. Η νοσταλγία και η μελαγχολία αμβλύνονται χάρη στις νέες φιλίες και στον έρωτα, σε μια διαδικασία επαναπροσδιορισμού της ταυτότητάς του."
https://www.filmfestival.gr/el/movie/movie/12290,"Σκανδιναβική σιωπή","Skandinaavia vaikus",2019,Εσθονία, Γαλλία, Βέλγιο,"Ένα ψυχολογικό δράμα σε τρεις πράξεις – τρεις διαφορετικές οπτικές της ίδιας ιστορίας, το οποίο έχει στο επίκεντρό του μια απόπειρα αδελφικής επανασύνδεσης. Σε ένα ταξίδι αυτογνωσίας που διατρέχει το υπνωτιστικό χειμωνιάτικο τοπίο, δύο αδέλφια αναπλάθουν ένα βίαιο περιστατικό του παρελθόντος, το οποίο τους έχει κληροδοτήσει ένα ασήκωτο ψυχολογικό φορτίο. Οι πληγές τους λαχταρούν την επούλωση, οι λέξεις και τα αισθήματα πρέπει να γεμίσουν τα κενά. Η αρχοντική απάθεια του απόκοσμου τοπίου αντιπαραβάλλεται με την εγγενή αδυναμία της ανθρώπινης επικοινωνίας, σε μια καθηλωτική εξερεύνηση της –τόσο ξεχωριστής– σκανδιναβικής σιωπής."
https://www.filmfestival.gr/el/movie/movie/12291,"Δε θέλω να γίνω δυσάρεστος, αλλά πρέπει να µιλήσουµε για κάτι πολύ σοβαρό","Δε θέλω να γίνω δυσάρεστος, αλλά πρέπει να µιλήσουµε για κάτι πολύ σοβαρό",2019,Ελλάδα,"O Άρης είναι ένα πετυχημένο στέλεχος μιας μεγάλης εμπορικής εταιρείας. Η ζωή του θα αλλάξει οριστικά όταν πληροφορηθεί πως είναι φορέας ενός σεξουαλικά μεταδιδόμενου ιού, θανατηφόρου μόνο για τις γυναίκες. Η ελπίδα για τη δημιουργία ενός εμβολίου μετατίθεται πάνω του, καθώς θα πρέπει να βρει ποια από τις πρώην σχέσεις του τού μετέδωσε το αρχικό στέλεχος του ιού. Ο Άρης ξεκινάει ένα υπαρξιακό ταξίδι συναντήσεων με τις πρώην του, όπου θα έρθει αντιμέτωπος με τις συνέπειες των επιλογών του."
https://www.filmfestival.gr/el/movie/movie/12292,"Τέρατα.","Monștri.",2019,Ρουμανία,"Η Ντάνα επιστρέφει από ένα επαγγελματικό ταξίδι, αλλά αποφασίζει να μη γυρίσει σπίτι και προσφέρει χρήματα σε έναν ταξιτζή, ώστε να της κρατήσει συντροφιά τη νύχτα. Την ίδια στιγμή, ο Άρτουρ κανονίζει ένα παράνομο ερωτικό ραντεβού που καταλήγει σε σεξουαλική συνεύρεση με έναν άντρα. Το επόμενο πρωί, η Ντάνα και ο Άρτουρ θα συναντηθούν στο συζυγικό τους κρεβάτι και θα περάσουν ολόκληρη τη μέρα μαζί, ίσως για τελευταία φορά. Ένα χαμηλόφωνο δράμα σχέσεων, που ξεδιπλώνεται σε τρεις πράξεις και αποτυπώνει τη χειροπιαστή μοναξιά και την αποξένωση της εποχής μας."
https://www.filmfestival.gr/el/movie/movie/12293,"Μια νύχτα μαγική","Chambre 212",2019,Γαλλία, Λουξεμβούργο, Βέλγιο,"Η Μαρία και ο Ρίτσαρντ είναι παντρεμένοι εδώ και 20 χρόνια. Όταν οι απιστίες της πρώτης έρχονται στο φως, η σχέση τους κλονίζεται. Η Μαρία εγκαταλείπει το διαμέρισμά τους και εγκαθίσταται σε ένα δωμάτιο ξενοδοχείου ακριβώς απέναντι, με την ελπίδα να παρατηρήσει τη ζωή της εξονυχιστικά, από μια προνομιακή θέση απόστασης. Στη διάρκεια μιας παραισθησιογόνου νύχτας, ένα πλήθος επισκέπτες θα περάσουν από το δωμάτιό της, καταθέτοντας την άποψή τους για την κρίση που περνά ο γάμος της. Ανάμεσα σε αυτούς θα είναι και ο σύζυγός της σε νεότερη ηλικία, ο οποίος όμως γνωρίζει την τωρινή κατάσταση. Μια παιχνιδιάρικη και καλοκουρδισμένη φάρσα δωματίου, που εξερευνά τις έννοιες της επιθυμίας, του συμβιβασμού και της νοσταλγίας."
https://www.filmfestival.gr/el/movie/movie/12294,"Ο προδότης","Il traditore",2019,Ιταλία, Γαλλία, Βραζιλία, Γερμανία,"Στις αρχές της δεκαετίας του ’80, ένας ολοκληρωτικός πόλεμος μαίνεται μεταξύ των αφεντικών της σισιλιάνικης Μαφίας. Ο Τομάζο Μπουσέτα, στέλεχος της Μαφίας, αναζητά καταφύγιο στη Βραζιλία, καθώς το ξεκαθάρισμα λογαριασμών έχει ξεκληρίσει όλους τους συμμάχους που είχε. Μετά τη σύλληψή του από τη βραζιλιάνικη αστυνομία και την έκδοσή του στην Ιταλία, ο Μπουσέτα οδηγείται σε μια απόφαση που άλλαξε τον ρου της σύγχρονης ιταλικής ιστορίας. Κανονίζει συνάντηση με τον δικαστή Τζοβάνι Φαλκόνε και αποκηρύσσει τους όρκους πίστης προς την Κόζα Νόστρα. Είναι πλέον ένας προδότης..."
https://www.filmfestival.gr/el/movie/movie/12295,"Άνωση","Buoyancy",2019,Αυστραλία,"Στα βάθη της καμποτζιανής ενδοχώρας, ο δεκατετράχρονος Τσάκρα δουλεύει στους ορυζώνες με την οικογένειά του. Διψά για ανεξαρτησία και έρχεται σε συνεννόηση με έναν μεσάζοντα που υπόσχεται πως θα του βρει δουλειά σε ένα εργοστάσιο στην Ταϊλάνδη. Χωρίς να πει κουβέντα σε κανέναν, ταξιδεύει στην Μπανγκόκ για να βρει την τύχη του. Μετά από το εξοντωτικό ταξίδι, συνειδητοποιεί την πικρή αλήθεια. Αυτός και οι συμπατριώτες συνταξιδιώτες του είναι πλέον σκλάβοι σε μια ψαρότρατα. Η ζωή του έχει πλέον μετατραπεί σε ένα ατελείωτο μαρτύριο και ο Τσάκρα αντιλαμβάνεται πως ο δρόμος προς την ελευθερία περνά μέσα από τη βία."
https://www.filmfestival.gr/el/movie/movie/12296,"Το συναρπαστικό μου καλοκαίρι με την Τες","Mijn bijzonder rare week met Tess",2019,Ολλανδία, Γερμανία,"Στη διάρκεια μιας εβδομάδας καλοκαιρινών διακοπών με την οικογένειά του, ο Σαμ βασανίζεται από τη σκέψη ότι μια μέρα –ως ο βενιαμίν της οικογένειας– θα μείνει ολότελα μόνος, αφού όλοι οι συγγενείς του θα έχουν πεθάνει νωρίτερα από αυτόν. Για να θωρακιστεί απέναντι στο αναπόφευκτο, o Σαμ επινοεί τη δική του «εκπαίδευση αντοχής στη μοναξιά». H «εκπαίδευση» διακόπτεται όταν συναντά την Τες, ένα κορίτσι που φαίνεται να είναι ακόμη πιο αλλόκοτο από τον ίδιο. Όταν η Τες του αποκαλύψει το μυστικό της, ο Σαμ θα συνειδητοποιήσει πως το να απομακρύνεσαι από αυτούς που αγαπάς δεν σε γλιτώνει απ’ τη μοναξιά."
https://www.filmfestival.gr/el/movie/movie/12297,"Κλειστός φάκελος Χάμαρσκελντ","Cold Case Hammarskjöld",2019,Δανία, Νορβηγία, Σουηδία, Βέλγιο,"To 1961, ταξιδεύοντας προς το Κονγκό για να συμμετάσχει σε ειρηνευτικές συνομιλίες, ο Σουηδός Γενικός Γραμματέας των Ηνωμένων Εθνών Νταγκ Χάμαρσκελντ βρίσκει τραγικό θάνατο σε αεροπορικό δυστύχημα, κάτω από ανεξιχνίαστες συνθήκες. Μισό αιώνα μετά, το θέμα έρχεται ξανά στο προσκήνιο, καθώς νέα στοιχεία βλέπουν το φως της δημοσιότητας. Επιχειρώντας να διαλευκάνει μια τραγωδία-μυστήριο, το ντοκιμαντέρ καταλήγει να αποκαλύψει άλλα αθέατα εγκλήματα και ένοχα μυστικά."
https://www.filmfestival.gr/el/movie/movie/12298,"Το κελάηδημα των πουλιών","El cant dels ocells",2008,Ισπανία,"Οι Τρεις Μάγοι περιπλανώνται στην έρημο αναζητώντας το Θείο Βρέφος, παγιδευμένοι σε μια υπαρξιακή δίνη. Κατοικούν, όπως το θέτει ο Άλμπερτ Σέρα, σε μια παράδοξη «γη του πουθενά», σε μια φευγαλέα εσοχή στον ιστορικό χωροχρόνο, στην οποία δεν έχει ακόμη αποκρυσταλλωθεί το βαθύτερο νόημα του χριστιανισμού. Οι τρεις άντρες είναι απελπισμένοι και πλανεμένοι ταξιδιώτες, αλλά συγχρόνως και αυθεντικά σύμβολα πίστης και αφοσίωσης. Ο φακός του Σέρα τούς παρατηρεί από απόσταση, αποτίνοντας φόρο τιμής στο θαύμα του ανθρώπου."
https://www.filmfestival.gr/el/movie/movie/12299,"Έγκλημα στα παρασκήνια","Έγκλημα στα παρασκήνια",1960,Ελλάδα,"Μια περιβόητη για τα ερωτικά της σκάνδαλα ηθοποιός, η Ρόζα Δελλή, βρίσκεται μαχαιρωμένη στο καμαρίνι της. Την υπόθεση αναλαμβάνει ο επιθεωρητής Μπέκας (Τίτος Βανδής) που καλείται να δώσει τις εξής απαντήσεις: ποιος σκότωσε και πώς έγινε ο φόνος, αφού η πόρτα βρέθηκε κλειδωμένη από μέσα; Ένας μαγικός κόσμος όλος μυστήριο και σαγήνη αναδύεται μέσα από τις σκιές αυτού του αρχετυπικού φιλμ νουάρ –από τα καλύτερα δείγματα του είδους στην Ελλάδα–, το οποίο το 2001 προβλήθηκε στο επίσημο πρόγραμμα του Φεστιβάλ των Καννών."
https://www.filmfestival.gr/el/movie/movie/12300,"Μια του Κλέφτη...","Μια του Κλέφτη...",1960,Ελλάδα,"Μια νεαρή κοπέλα, μετά από μία παρεξήγηση, προσπαθεί να βάλει στον ίσιο δρόμο ένα νέο που τον θεωρεί κλέφτη. Τα πράγματα όμως αλλάζουν όταν ανακαλύπτει ότι δεν είναι κλέφτης, αλλά ένας από τους πιο πετυχημένους δικηγόρους της Αθήνας. Η ιστορία ενός ερωτικού ειδύλλιου ανάμεσα σε δυο νέους, που γεννιέται σ' ένα νησί του Αιγαίου και έχει αίσιο τέλος στην πρωτεύουσα. Αισθηματική κωμωδία που στηρίζεται σ' ένα παλιότερο θεατρικό έργο του σκηνοθέτη και διακρίθηκε την Πρώτη Εβδομάδα Ελληνικού Κινηματογράφου με βραβείο πρώτου ανδρικού ρόλου για την εμβληματική ερμηνεία του Δημήτρη Χορν."
https://www.filmfestival.gr/el/movie/movie/12301,"Μανταλένα","Μανταλένα",1960,Ελλάδα,"Η κόρη ενός φτωχού βαρκάρη, μετά τον θάνατο του πατέρα της, προσπαθεί να τον διαδεχθεί στο επάγγελμα και να συντηρήσει τα έξι μικρά της αδέλφια. Καλείται όμως να αντιμετωπίσει το σκληρό ανταγωνισμό ενός καλοβαλμένου καραβοκύρη, τον οποίο τελικά ερωτεύεται. Η θάλασσα της Αντιπάρου που αποτυπώνεται από τον Γουόλτερ Λάσαλι σε ασπρόμαυρο φιλμ σαν να ήταν χρυσή, ο Μάνος Χατζιδάκις που γράφει τις ομορφότερες μελωδίες του για τον κινηματογράφο και, φυσικά, η Αλίκη Βουγιουκλάκη που εδώ εκτοξεύεται με μιας στο πάνθεον του ελληνικού σινεμά είναι μερικοί μόνο λόγοι που καθιστούν τη"
https://www.filmfestival.gr/el/movie/movie/12302,"Μακεδονικός γάμος","Μακεδονικός γάμος",1960,Ελλάδα,"Γυρισμένη στο Βελβεντό Κοζάνης, η πρώτη ταινία του Τάκη Κανελλόπουλου είναι ένα ντοκιμαντέρ μικρού μήκους που περιγράφει τα ήθη και τα έθιμα που σχετίζονται με τον παραδοσιακό γάμο στη Δυτική Μακεδονία. Η ιδιαίτερη ποιητική ματιά του σκηνοθέτη μεταμορφώνει ένα δείγμα του λεγόμενου «εθνογραφικού» κινηματογράφου σε λυρικό ποίημα για τις ρίζες των ανθρώπων σε έναν προαιώνιο, αλλά ήδη χαμένο κόσμο. Η ταινία απέσπασε το πρώτο βραβείο ταινίας μικρού μήκους στην Πρώτη Εβδομάδα Ελληνικού Κινηματογράφου, καθώς και το Α΄ Βραβείο στο Φεστιβάλ Βελιγραδίου της επόμενης χρονιάς."
https://www.filmfestival.gr/el/movie/movie/12303,"Υπόθεση Μακαβέγιεφ ή Δίκη σε μια κινηματογραφική αίθουσα","Slucaj Makavejev ili Proces u bioskopskoj sali",2019,Σερβία,"Ένα ντοκιμαντέρ που διερευνά τη θέση που επιφύλασσε η πρώην σοσιαλιστική Γιουγκοσλαβία στους καλλιτέχνες-κινηματογραφιστές. Πιο συγκεκριμένα, το ντοκιμαντέρ επικεντρώνεται στην πολιτική συγκυρία και την περιρρέουσα ατμόσφαιρα που επικράτησε στη γιουγκοσλαβική κοινωνία της εποχής, που οδήγησαν –προφανώς με την ενορχήστρωση του γιουγκοσλαβικού Κομμουνιστικού Κόμματος– στην απαγόρευση της ταινίας του Μακαβέγιεφ"
https://www.filmfestival.gr/el/movie/movie/12304,"Μελτέμ","Meltem",2019,Γαλλία, Ελλάδα,"Ένα χρόνο μετά τον θάνατο της μητέρας της, η Έλενα, νεαρή Γαλλίδα ελληνικής καταγωγής, επιστρέφει στη Λέσβο με τον Νασίμ και τον Σεκού, δυο φίλους της από τα παρισινά προάστια. Το πρόγραμμα των διακοπών ανατρέπεται όταν συναντούν τον Ελιάς, ένα νεαρό Σύρο πρόσφυγα που έφτασε πριν λίγο καιρό στο νησί..."
https://www.filmfestival.gr/el/movie/movie/12305,"Αύριο περνάω απέναντι","Demain, je traverse",2019,Ελλάδα, Γαλλία, Λουξεμβούργο, Ολλανδία,"Πρόκειται για τη συνάντηση μεταξύ δύο ευαίσθητων και εύθραυστων ανθρώπων σε μια δύσκολη καμπή της ζωής τους. Της Μαρίας, μιας Ελληνίδας αστυνομικού που παίρνει μετάθεση για τη Λέσβο, και ενός Σύριου πρόσφυγα που καταφθάνει εκεί. Η σχέση τους θα είναι μικρή, αλλά έντονη, και θα αλλάξει τον τρόπο που βλέπουν τον κόσμο."
https://www.filmfestival.gr/el/movie/movie/12306,"Cosmic Candy","Cosmic Candy",2019,Ελλάδα,"Η Άννα, μια μοναχική και ιδιόρρυθμη ταμίας σουπερμάρκετ, αναγκάζεται να πάρει υπό την προστασία της το δεκάχρονο κορίτσι του διπλανού διαμερίσματος, ύστερα από την μυστηριώδη εξαφάνιση του πατέρα του. Την ίδια στιγμή διαπραγματεύεται την πιθανή της απόλυση και ένα ρομαντικό ειδύλλιο για πρώτη φορά στη ζωή της. Και όλα αυτά υπό την επήρεια υπερβολικής ποσότητας Κόσμικ Κάντι, της καραμέλας που σκάει στο στόμα."
https://www.filmfestival.gr/el/movie/movie/12307,"Μπαμπάς","Pappa",2018,Νορβηγία,"Στιβαρός σαν κινηματογραφικός ήρωας, ντυμένος με κοστούμι και γραβάτα, ο μπαμπάς εμφανίζεται ένα βράδυ στο παράθυρο, από το πουθενά, φέρνοντας ένα δώρο για τον γιο του. Ο μπαμπάς είναι δυνατός και γενναίος. Ελευθερώνει ζώα σε αιχμαλωσία, θριαμβεύει σε κούρσες με το αμάξι του που τρέχει σαν αστραπή και βουτά στα απύθμενα και τρομακτικά βάθη του ωκεανού. Ο μπαμπάς είναι μάγος. Μπορεί να εμφανίζεται και να εξαφανίζεται σε μια στιγμή, έτσι απλά. Ένα τρυφερό και γλυκό παραμύθι για την απουσία του πατέρα, που παρηγορεί την παιδική ψυχή."
https://www.filmfestival.gr/el/movie/movie/12308,"Κατ Λέικ Σίτι","Cat Lake City",2019,Γερμανία,"Ετοιμαστείτε να γνωρίσετε τον Πέρσι, έναν αξιαγάπητο γάτο που ανυπομονεί για την ξεκούραση και την ξεγνοιασιά που τόσο αξίζει. Προορισμός του η"
