https://www.filmfestival.gr/el/movie/movie/12481,"Άνταμ και Έβελιν","Adam und Evelyn",2018,Γερμανία,"Η ταινία Άνταμ και Έβελιν είναι η ιστορία ενός ζευγαριού από την επαρχία της Ανατολικής Γερμανίας η οποία διαδραματίζεται το καλοκαίρι και το φθινόπωρο του 1989. Ο Άνταμ είναι ένας ράφτης που έχει δημιουργήσει μια βολική γωνίτσα για τον εαυτό του, ενώ η Έβελιν εργάζεται ως σερβιτόρα. Όταν τσακώνει τον Άνταμ να αγκαλιάζειμια πελάτισσά του, φεύγει θυμωμένη. Πηγαίνει διακοπές στην Ουγγαρία, παίρνοντας μαζί της όχι τον Άνταμ, όπως σχεδίαζαν, αλλά τη φίλη της τη Σιμόν και το αγόρι της τελευταίας, τον Δυτικογερμανό Μάικλ. Ο Άνταμ ακολουθεί την Έβελυν. Καθ’ οδόν προς την Ουγγαρία, παίρνει μαζί του στο αυτοκίνητο την Κάτια, η οποία προσπαθεί να περάσει τα όλο και πιο διάτρητα σύνορα και να διαφύγει στη Δύση. Ξανά και ξανά, ο Άνταμ ανοίγει τα μάτια του σαν να ξυπνά από ένα όνειρο."
https://www.filmfestival.gr/el/movie/movie/12343,"1 μέτρο/ώρα","1 Mètre/Heure",2018,Γαλλία,"Μπλεγμένοι σε μια δίνη στρες και άγχους, έχουμε πείσει τον εαυτό μας ότι ο χρόνος ισοδυναμεί με χρήμα. Τα πάντα οφείλουν να γίνονται γρήγορα και αποδοτικά, χωρίς καμία καθυστέρηση. Στην εποχή μας, σπανίως παίρνουμε τον χρόνο να ρίξουμε μια ματιά σε ό,τι μας περιβάλλει, να ξετρυπώσουμε όλες εκείνες τις θαυμαστές λεπτομέρειες που είναι καταδικασμένες να μείνουν άφαντες. Πόσο κρίμα να πηγαίνει τόση ομορφιά χαμένη! Μια τέτοια περίπτωση είναι και αυτή η αξιαγάπητη συντροφιά από σαλιγκάρια που γλιστρούν και χορεύουν μπροστά στα μάτια μας, μετατρέποντας το φτερό ενός αεροπλάνου σε πίστα χορού. Η ταχύτητα, όπως τα πάντα στη ζωή, είναι ζήτημα οπτικής..."
https://www.filmfestival.gr/el/movie/movie/12182,"Υπάρχει Θεός, το όνομά της είναι Πετρούνια","Gospod postoi, imeto i' e Petrunija",2019,Βόρεια Μακεδονία, Βέλγιο, Σλοβενία, Γαλλία,, Κροατία,"Θεοφάνεια. Σε μια μικρή πόλη, κάπου στη Βόρεια Μακεδονία, ο αγιασμός των υδάτων είναι από τις πιο σημαντικές στιγμές για την κοινότητα, καθώς επικρατεί η πεποίθηση πως το πρόσωπο που πιάνει τον σταυρό θα έχει ευλογία και καλή τύχη στη ζωή του. Τη μεγάλη μέρα, κόντρα σε ό,τι ορίζει η παράδοση, μια άνεργη ανύπαντρη γυναίκα βουτάει στο νερό και πιάνει τον σταυρό. Εξοργισμένοι που έμειναν με άδεια χέρια, οι άντρες την κατηγορούν για ασέβεια. Η γυναίκα, όμως, αρνείται να παραδώσει τον σταυρό. Διότι είναι πια έτοιμη να αντισταθεί στα έμφυλα στερεότυπα ενός κόσμου συντηρητικού."
https://www.filmfestival.gr/el/movie/movie/12188,"Γκούνις: Το κυνήγι της μεγάλης περιπέτειας","The Goonies",1985,ΗΠΑ,"Οι Γκούνις, μια συμμορία νεαρών στην πόλη της Αστόρια, ανακαλύπτουν έναν παλιό χάρτη στην σοφίτα ενός σπιτιού, ο οποίος δείχνει τον δρόμο για τον χαμένο θησαυρό του πειρατή Μονόφθαλμου Γουίλι. Η σύμπραξη του Ρίτσαρντ Ντόνερ (σκηνοθεσία) με τον Κρις Κολόμπους (σενάριο) και τον Στίβεν Σπίλμπεργκ (παραγωγή) μάς έδωσε μια από τις αγαπημένες και πιο εμβληματικές ταινίες της δεκαετίας του ’80."
https://www.filmfestival.gr/el/movie/movie/12189,"Επιστροφή στη χώρα του Οζ","Return to Oz",1985,Ηνωμένο Βασίλειο, ΗΠΑ,"Η Ντόροθι επιστρέφει στο σπίτι της μιλώντας διαρκώς για τη χώρα του Οζ. Η οικογένειά της την κλείνει σε μια ψυχιατρική κλινική, όπου θέλουν να τη θεραπεύσουν με ηλεκτροσόκ. Μια από τις πιο σκοτεινές ταινίες της Ντίσνεϊ, ένα παιδικό φιλμ που περιλαμβάνει κομμένα κεφάλια, συμμορίες μηχανόβιων τεράτων και καναπέδες που ζωντανεύουν αν τους πασπαλίσεις με ψυχεδελική σκόνη. Η Φαϊρούζα Μπαλκ καταπληκτική στο ντεμπούτο της ως Ντόροθι και ο θρύλος του sound design Γουόλτερ Μερτς στη μοναδική ταινία που σκηνοθέτησε."
https://www.filmfestival.gr/el/movie/movie/12223,"Κατάποση","Swallow",2019,ΗΠΑ, Γαλλία,"Μια νεαρή έγκυος γυναίκα, που έχει θυσιάσει κάθε προσωπική επιθυμία στον βωμό της οικογενειακής γαλήνης, καταλαμβάνεται αιφνιδίως από την ανεξήγητη ορμή να καταβροχθίζει μη βρώσιμα αντικείμενα. Ωστόσο, η συγκεκριμένη πάθηση –που είναι υπαρκτή και φέρει την ονομασία αλλοτροφαγία (pica)– δεν πρόκειται να μας απασχολήσει από ιατρική σκοπιά, παρά λειτουργεί ως εύγλωττη μεταφορά. Ένα προβοκατόρικο και βραδυφλεγές ψυχολογικό θρίλερ, με λεπτοδουλεμένες στρώσεις βιτριολικού χιούμορ, που τρυπώνει κάτω από τη γυαλισμένη επιφάνεια για να φέρει στο προσκήνιο την υπόκωφη καταπίεση που ασκούν οι πατριαρχικές κοινωνικές δομές και οι προκαθορισμένοι ρόλοι."
https://www.filmfestival.gr/el/movie/movie/12224,"Το τέλος του αιώνα","Fin de siglo",2019,Αργεντινή, ΗΠΑ,"Δύο άνδρες, ένας Αργεντίνος από τη Νέα Υόρκη και ένας Ισπανός από το Βερολίνο, συναντιούνται τυχαία στη Βαρκελώνη και περνούν τη νύχτα μαζί. Μια φαινομενικά εφήμερη συνεύρεση μεταξύ δύο αγνώστων μετατρέπεται σε ένα κοσμικό ταξίδι αγάπης, το οποίο απλώνεται σε έναν ορίζοντα δεκαετιών, αποκτώντας διαστάσεις αλληγορικές και ονειρώδεις. Σαν ευφάνταστο αίνιγμα, η ταινία ξεδιπλώνεται μέσα από μια μη γραμμική αφήγηση, όπου ο χώρος και ο χρόνος λειτουργούν με άλλους κανόνες, εκπλήσσοντας διαρκώς τον θεατή."
https://www.filmfestival.gr/el/movie/movie/12225,"Η ανθολογία μιας πόλης-φάντασμα","Répertoire des villes disparues",2018,Καναδάς,"Ένα χωριό στην περιοχή του Κεμπέκ συνταράσσεται από την απρόσμενη απώλεια ενός 21χρονου. Παρότι δεν είναι ξεκάθαρο αν πρόκειται για ατύχημα ή αυτοκτονία, όλοι υποψιάζονται ότι ισχύει το δεύτερο. Η τραγωδία βυθίζει το χωριό στο πένθος, στην αμηχανία και την ένοχη σιωπή, ενώ παράλληλα σηματοδοτεί την εμφάνιση αλλόκοτων φαινομένων: αμίλητες φιγούρες εμφανίζονται φευγαλέα, ανεξήγητοι θόρυβοι ηχούν στο κενό.. Μια αινιγματική και ατμοσφαιρική αλληγορία για τον μαρασμό των μικρών κοινοτήτων, τη δυσκολία αποδοχής του Άλλου, την αδυναμία ενσωμάτωσης του επώδυνου παρελθόντος στο εύθραυστο παρόν."
https://www.filmfestival.gr/el/movie/movie/12226,"Το τελευταίο δέντρο","The Last Tree",2019,Ηνωμένο Βασίλειο,"Ο Φέμι, ένας 11χρονος νιγηριανής καταγωγής, αναγκάζεται να μετακομίσει από την αγγλική επαρχία στο γκρίζο αστικό τοπίο του Λονδίνου. Με μια πρώτη ματιά, η αλλαγή αυτή φαντάζει θετική∙ θα ζήσει με τη βιολογική του μητέρα και, στο καινούργιο σχολείο, δεν θα είναι πια δακτυλοδεικτούμενος. Τα φαινόμενα όμως απατούν και ο Φέμι βιώνει μια πρωτόγνωρη μοναξιά, έχοντας απολέσει κάθε αίσθημα ασφάλειας. Μια τρυφερή και συνάμα τραχιά ιστορία ενηλικίωσης, με πρωταγωνιστή έναν έφηβο που παλεύει να συμφιλιωθεί με τις ρίζες του και να βρει τον δρόμο του σε ένα εχθρικό περιβάλλον."
https://www.filmfestival.gr/el/movie/movie/12227,"Το καταφύγιο","The Lodge",2019,ΗΠΑ, Ηνωμένο Βασίλειο,"Δύο ανήλικα κορίτσια και η Γκρέις, η νέα σύντροφος του πατέρα τους, κάνουν πρόωρες χριστουγεννιάτικες διακοπές στην απομονωμένη ορεινή εξοχική κατοικία της οικογένειας. Ενώ ο πάγος μεταξύ τους δείχνει να σπάει, μια σειρά από ανεξήγητα γεγονότα κάνουν την εμφάνισή τους. Πολύ σύντομα, θα βρεθούν παντελώς μόνες και αβοήθητες στο έλεος μιας επικείμενης θύελλας. H ψυχική ισορροπία της Γκρέις κινείται σε τεντωμένο σχοινί, και τα όρια μεταξύ πραγματικότητας και νοσηρής φαντασίας θολώνουν επικίνδυνα. Τώρα πια, οι εσωτερικοί δαίμονες και τα ανεπούλωτα τραύματα ενός σκοτεινού παρελθόντος έχουν πάρει τα ηνία."
https://www.filmfestival.gr/el/movie/movie/12228,"Παπίσα","Papicha",2019,Γαλλία, Αλγερία, Βέλγιο, Κατάρ,"Αλγερία, 1997. Η χώρα σπαράσσεται από εμφύλιο πόλεμο, φέρνοντας την αυταρχική κυβέρνηση αντιμέτωπη με τρομοκρατικές ομάδες φονταμενταλιστών, που επιθυμούν να μετατρέψουν τη χώρα σε θεοκρατικό ισλαμικό κράτος. Σε αυτό το πνιγηρό περιβάλλον, οι γυναίκες που αρνούνται να συμμορφωθούν με τον ατελείωτο κατάλογο απαγορεύσεων γίνονται αντικείμενο βίαιων επιθέσεων και διώξεων. Μια νεαρή φοιτήτρια, παθιασμένη με τη μόδα, αποφασίζει να επαναστατήσει από το δικό της μετερίζι. Πείθει τις γυναίκες που φοιτούν στο πανεπιστήμιό της να διοργανώσουν μια επίδειξη μόδας, η οποία αποκτά συμβολικές διαστάσεις αντίστασης ενάντια στον σκοταδισμό."
https://www.filmfestival.gr/el/movie/movie/12229,"Θα έρθουν απαλές βροχές","Vendrán lluvias suaves",2018,Αργεντινή,"Σε μια υποβαθμισμένη γειτονιά στα προάστια, μια παρέα παιδιών έρχεται αντιμέτωπη με ένα αλλόκοτο περιστατικό, το οποίο σύντομα θα πάρει διαστάσεις επιδημίας: οι ενήλικες έχουν μεταμορφωθεί σε «κοιμισμένα όντα» και δεν λένε να ξυπνήσουν. Παρότι τρομοκρατημένα, τα παιδιά είναι αποφασισμένα να συνεχίσουν μόνα τους με σθένος, διατηρώντας την ελπίδα πως κάποτε, με κάποιον τρόπο, οι γονείς τους θα «επιστρέψουν». Καθώς ξεδιπλώνεται αυτή η ατμοσφαιρική και παράδοξη ιστορία, τα ίχνη των απόντων μάς αφηγούνται τη ζωή τους. Μια ποιητική ματιά στην απώλεια και τη μοναξιά, μια σιωπηλή κραυγή για συντροφικότητα και ανθρώπινη επαφή."
https://www.filmfestival.gr/el/movie/movie/12230,"Τλαμές","Tlamess",2019,Τυνησία, Γαλλία,"Μετά τον θάνατο της μητέρας του, ένας νεαρός στρατιώτης ονόματι «S» παίρνει άδεια μίας εβδομάδας από τα καθήκοντά του και επιστρέφει σπίτι. Όταν καλείται να επιστρέψει στο στρατόπεδο, λιποτακτεί και περιφέρεται, εξαθλιωμένος και καταζητούμενος, σε μια δυστοπική ερημιά. Η «F» είναι μια έγκυος γυναίκα, εγκλωβισμένη σε μια οκνηρή ζωή σε ένα απομονωμένο πολυτελές παλάτι. Δυο χαμένες ψυχές, που θα έρθουν σε επαφή κάτω από αλλόκοτες συνθήκες και θα συνδεθούν με τρόπο υπερβατικό. Μια συρραφή μυθολογικών στοιχείων, σε έναν καμβά που συνδυάζει τον ανόθευτο ρεαλισμό και τον ελεγειακό λυρισμό."
https://www.filmfestival.gr/el/movie/movie/12231,"Δόλωμα","Bait",2018,Ηνωμένο Βασίλειο,"Σε ένα παραθαλάσσιο ψαροχώρι της Κορνουάλης, οι συνήθειες έχουν αλλάξει δραματικά. Το τοπικό στοιχείο αποτελεί πια ντεκόρ σε καρτ ποστάλ και η αλιεία έχει παραδώσει τη σκυτάλη στον τουρισμό – οι κάτοικοι έχουν μετατρέψει τον πατροπαράδοτο τρόπο ζωής σε «δόλωμα», προκειμένου να προσελκύσουν εύρωστους επισκέπτες. Δύο αδέρφια, ο υπέρμαχος της παράδοσης Martin και ο πραγματιστής Steven, ενσαρκώνουν τις δύο όψεις της νέας πραγματικότητας. Η ένταση αυξάνει επικίνδυνα, και η επερχόμενη τραγωδία θα σφραγίσει αμετάκλητα τη μοίρα τους. Ένα τραχύ και υπνωτιστικό οδοιπορικό σε κιαροσκούρο αποχρώσεις, γυρισμένο σε φιλμ 16 χιλιοστών με κάμερα Bolex. Ένα δυσοίωνο όνειρο που προφητεύει το τέλος ενός κόσμου που φθίνει αργά και βασανιστικά."
https://www.filmfestival.gr/el/movie/movie/12232,"Μια σύντομη ιστορία από τον πράσινο πλανήτη","Breve historia del planeta verde",2019,Αργεντινή, Γερμανία, Βραζιλία, Ισπανία,"Η Τάνια, η Ντανιέλα και ο Πέδρο είναι τρεις αχώριστοι φίλοι, που έχουν μάθει να αντιμετωπίζουν με αποφασιστικότητα την εχθρότητα που εισπράττουν από τον περίγυρό τους. O θάνατος της γιαγιάς της Τάνια τούς φέρνει πίσω στη συντηρητική πόλη των παιδικών τους χρόνων, όπου ανακαλύπτουν ένα εξωφρενικό μυστικό: τα τελευταία χρόνια της ζωής της, ένα εξωγήινο πλάσμα κρατούσε συντροφιά στη γιαγιά της Τάνια. Οι τρεις φίλοι, «εξωγήινοι» και οι ίδιοι σε έναν κόσμο αφιλόξενο και μισαλλόδοξο, αναλαμβάνουν μια ιερή αποστολή. Ο νέος τους φίλος πρέπει να επιστρέψει σπίτι του, προτού να είναι αργά."
https://www.filmfestival.gr/el/movie/movie/12233,"Τα παιδιά των νεκρών","Die Kinder der Toten",2019,Αυστρία,"Στο μυθιστόρημα"
https://www.filmfestival.gr/el/movie/movie/12234,"Λερός Θεός","Dirty God",2019,Ολλανδία, Ηνωμένο Βασίλειο, Βέλγιο, Ιρλανδία,"Έχοντας πέσει θύμα μιας άγριας επίθεσης με οξύ που παραμόρφωσε το πρόσωπό της, η Τζέιντ, μια νεαρή χωρισμένη μητέρα, καλείται να συμφιλιωθεί με τις σωματικές και ψυχικές ουλές και να επαναπροσδιορίσει την ταυτότητά της. Ένα στιβαρό φεμινιστικό μανιφέστο, που φέρνει στο προσκήνιο τον ανομολόγητο μισογυνισμό της εποχής μας, αποφεύγοντας τα κλισέ και τον διδακτισμό. Ταυτόχρονα, ένα δηκτικό σχόλιο για τον κόσμο της απατηλής ομορφιάς που έχει κατακλύσει τις οθόνες και, κατ’ επέκταση, τις ζωές μας. Εντέλει, ένα χαμηλόφωνο οικογενειακό δράμα για την αποδόμηση των παραδοσιακών σχέσεων και την αποξένωση σε έναν κατακερματισμένο κοινωνικό ιστό."
https://www.filmfestival.gr/el/movie/movie/12235,"Δεκατεσσάρων","Fourteen",2019,ΗΠΑ,"Η Τζο είναι ελεύθερο πνεύμα, επιρρεπής σε νευρικές κρίσεις ήδη από την εφηβεία, και τώρα παλεύει να κρατήσει τη δουλειά της ως κοινωνικού λειτουργού. Η Μάρα, μια νηπιαγωγός που πατάει γερά στα πόδια της, είναι εδώ και χρόνια η καλύτερή της φίλη, από τότε που η Τζο τη βοήθησε σε ένα περιστατικό μπούλινγκ. H Μάρα βάζει τα δυνατά της για να στηρίζει τη φίλη της στα δύσκολα, όμως σταδιακά φτάνει στα όριά της, καθώς η Τζο βυθίζεται όλο και περισσότερο στην αυτοκαταστροφή. Ένα ελλειπτικό χρονικό των τελευταίων ημερών μιας μακρόχρονης φιλίας, με φόντο το μουντό τοπίο μιας ανυπέρβλητης μοναξιάς."
https://www.filmfestival.gr/el/movie/movie/12236,"Νυχτωδία","Nocturne",2019,Ολλανδία, Βέλγιο,"Μια μέρα πριν την έναρξη των γυρισμάτων της πρώτης του ταινίας, ένας νεαρός και φιλόδοξος σκηνοθέτης πασχίζει να βάλει τα κομμάτια του παζλ στη θέση τους. Ο χρόνος πιέζει αμείλικτα, οι παραγωγοί έχουν αρχίσει να χάνουν την υπομονή τους και οι συνεργάτες του έχουν αμέτρητες απορίες. Σαν να μην έφταναν όλα αυτά, η συναισθηματική και οικογενειακή ζωή του βρίσκεται στα τάρταρα. Έχοντας αγγίξει τα όρια της απελπισίας, ξεχύνεται στους δρόμους και βυθίζεται σε έναν ονειρώδη νυχτερινό λαβύρινθο. Καθώς αναζητά τον μίτο της έμπνευσης, η φαντασία αρχίζει να υποκαθιστά την πραγματικότητα."
https://www.filmfestival.gr/el/movie/movie/12237,"Τρεις αδερφές","Kiz Kardeşler",2019,Τουρκία, Γερμανία, Ολλανδία, Ελλάδα,"Τρεις αδερφές, που είχαν σταλεί παρακόρες σε πλούσιες οικογένειες στην πόλη, συναντιούνται ξανά μετά από χρόνια, όταν αναγκάζονται, για διαφορετικούς λόγους, να επιστρέψουν στο πατρικό τους σε ένα φτωχό χωριό της ορεινής Ανατολίας. Στη σκιά των χιονισμένων βουνοκορφών, υπό το βλέμμα του αυταρχικού πατέρα, οι τρεις γυναίκες μοιάζει να επαναλαμβάνουν τα λάθη του παρελθόντος, σε ένα ζοφερό υπνωτιστικό παραμύθι που συνδυάζει Τσέχοφ και αδερφούς Γκριμ. Με φόντο ένα μαγευτικό αλλόκοσμο τοπίο, που τη νύχτα μεταμορφώνεται σε τρομακτικό τόπο αθέατων κινδύνων, η ζωή αποτυπώνεται ως αέναη κυκλική πορεία –πολλές σκηνές μάλιστα φαίνεται να επαναλαμβάνονται–, η οποία οδηγεί αναπόδραστα στην καταστροφή."
https://www.filmfestival.gr/el/movie/movie/12238,"Γη του Νώε","Nuh Tepesi",2019,Γερμανία, Τουρκία, ΗΠΑ,"Έχοντας διαγνωστεί με μια ανίατη ασθένεια, ο Ιμπραήμ, που νιώθει το τέλος να πλησιάζει, ζητά από τον αποξενωμένο του γιο να τον μεταφέρει στη γενέτειρά του, ένα απομακρυσμένο χωριό στην τουρκική επαρχία. Η τελευταία του επιθυμία είναι να ταφεί στον ίσκιο του ελαιόδεντρου που –όπως ισχυρίζεται– φύτεψε ο ίδιος πριν από μερικές δεκαετίες. Ωστόσο, τα πράγματα περιπλέκονται, αφού οι ντόπιοι πιστεύουν πως πρόκειται για δέντρο ιερό, το οποίο προήλθε από τον σπόρο που έθαψε στη γη ο Νώε, αμέσως μετά τον Κατακλυσμό. Μια ευρηματική παραβολή για τη μετάνοια, την εμπιστοσύνη και τη δύναμη της συγχώρεσης στις ανθρώπινες σχέσεις."
